id,question,answer
472,相同尺寸的杂货船，采用纵骨架式比采用横骨架式装货,少
473,杂货船一般采用的结构形式是,混合骨架式结构
474,船体结构形式有,横骨架式、纵骨架式、混合骨架式
475,纵骨架式船体结构比横骨架式船体结构建造,困难
476,甲板所受的总纵弯曲应力比船底所受的弯曲应力,大
477,相同尺寸的船舶，采用纵骨架式比采用横骨架式的船体重量,轻
478,船体结构抵抗各种内力和外力作用的能力称为,船体强度
479,船体受剪力最大的部位是,距首尾1／4船长处
480,船体发生纵向弯曲变形和破坏是由于,总纵弯曲强度不足
481,对船体总纵强度最起作用的是,甲板和船底
482,船舶在海上遇到“标准波”时，当船舶处于什么状态时，浮力的分布对船体总纵强度是最不利的,船中位于波峰、船中位于波谷
483,船中处于波峰时，船舶处于什么状态,中拱
484,中机型货舱满载航行遇到波浪时，可能会发生什么变形,中拱弯曲变形
485,油船满载航行遇到波浪时，可能会发生什么变形,中垂弯曲变形
486,在船体结构图中的粗点划线表示,不可见主要构件
487,在船舶总布置图中横向构件和纵向构件是标注在何种图纸上,横剖面图
488,船舶最上一层连续甲板通常称为,上甲板
489,根据甲板上下位置不同，最上一层连续甲板称为,上甲板
490,宽度等于上甲板宽度的肿部上层建筑叫,桥楼
491,上甲板以下的第一层甲板称为,第二甲板
492,船舶最高一层甲板和船体最高一层全通甲板分别为,罗经甲板，上甲板
493,主船体是指,上甲板以下的船体
494,两侧壁到舷边的距离大于4％船宽的上层建筑叫,甲板室
495,船舶甲板室设置在哪儿,可设在局部、中部，不能设在首部
496,长首楼和长尾楼的长度分别超过船长的,25％，25％
497,船上蓄电池室一般位于,艇甲板上
498,灯具间、油漆间一般位于,首楼内
499,应急发电机室一胶位于,艇甲板
